Database_ID,Database_Name,Associated_Subjects,Original_Description_HTML,Rewritten_Description_A_HTML,Rewritten_Description_B_HTML,Database_URL,
61499070,"American Race Relations: Global Perspectives, 1941-1996",African American Studies;American Studies;Asian American Studies;Chicana & Chicano Studies;Criminal Justice;History;Latin American Studies;Political Science;Anthropology;Cultural Anthropology;Native American Studies,"&lt;img alt=&quot;Covered in OneSearch&quot; src=&quot;https://libapps.s3.amazonaws.com/accounts/7085/images/SmallOneSearchO.png&quot; title=&quot;Covered in OneSearch&quot; /&gt; The only fully searchable digital archive, available via Readex platform; covering foreign perspectives of American racial issues in the mid-20th century, American Race Relations: Global Perspectives is derived from the archives of the Central Intelligence Agency. A wealth of unique primary source documents on racial justice from around the world, it provides new insight into many of the most important historical events and movements of the last hundred years. Covering topics like segregation, race riots, arts and literature, Brown v. Board of Education and other important court cases, the Civil Rights Movement, the Black Panthers, Martin Luther King, Jr. and the rise of indigenous rights in countries around the world, this archive provides unique viewpoints on Americas fight for racial justice and rare insight into race relations in Latin America, Europe, Africa and Asia.", DESCRIPTION A PLACEHOLDER, DESCRIPTION B PLACEHOLDER,https://infoweb.newsbank.com/apps/readex/welcome?p=TOPRACE,
61666972,Rafu Shimpo,American Studies;Asian American Studies;History;Modern Languages & Literatures,"Begun in 1903 supporting the small but growing Japanese community in the Little Tokyo area of Los Angeles, The Rafu Shimpo (????, L.A. Japanese Daily News) is the preeminent Japanese American newspaper in the United States. By the 1940s it was the most widely circulated paper in the region and included a weekly English section for second generation Japanese Americans. A valuable source with full search capabilities, The Rafu Shimpo rests squarely at the intersection of Japanese history and the Japanese American migr community with its unique coverage of news, community history, and announcements of births, marriages, and deaths, with full high-quality page images, including photos, graphics and advertisements, from every issue available.", DESCRIPTION A PLACEHOLDER, DESCRIPTION B PLACEHOLDER,https://gpa.eastview.com/rafu/,
62130202,"African Diaspora: Cultural, Social and Political History, 1860 - Present",African American Studies;American Studies;History;Political Science;Anthropology;Archaeological Anthropology;Cultural Anthropology;Database EBA,"&lt;p&gt;&lt;img src=&quot;https://libapps.s3.amazonaws.com/accounts/7085/images/SmallOneSearchO.png&quot; alt=&quot;Covered in OneSearch&quot; width=&quot;17&quot; height=&quot;15&quot;&gt;The contributions, struggles, and identities of those who lived the African Diaspora come to life through personal accounts, video, and primary sources in this global black studies collection that focuses on the migrations, communities, and ideologies of people of African descent. The collection includes never-before digitized primary source documents, including books, government documents, personal papers, organizational papers, journals, newsletters, court documents, letters, and ephemera from the Caribbean, Brazil, India, United Kingdom, and France.&lt;/p&gt;&lt;p&gt;&lt;strong&gt;Available through June 30, 2025&lt;/strong&gt;&lt;/p&gt;", DESCRIPTION A PLACEHOLDER, DESCRIPTION B PLACEHOLDER,https://search.alexanderstreet.com/afdi,
62130205,Black Drama: Third Edition,African American Studies;American Studies;History;Theatre,"&lt;img alt=&quot;Covered in OneSearch&quot; src=&quot;https://libapps.s3.amazonaws.com/accounts/7085/images/SmallOneSearchO.png&quot; title=&quot;Covered in OneSearch&quot; /&gt;  Black Drama contains the full text of more than 1,700 plays written from the mid-1800s to the present by more than 200 playwrights from North America, English-speaking Africa, the Caribbean, and other African diaspora countries. More than 40 percent of the collection consists of previously unpublished plays by writers such as Langston Hughes, Ed Bullins, Willis Richardson, Amiri Baraka, Randolph Edmonds, Zora Neale Hurston, and many works are rare, hard to find, or out of print.", DESCRIPTION A PLACEHOLDER, DESCRIPTION B PLACEHOLDER,https://search.alexanderstreet.com/bld3,
62130206,Border and Migration Studies Online,English and Comparative Literature;American Studies;Chicana & Chicano Studies;Criminal Justice;History;Latin American Studies;Political Science;Anthropology;Cultural Anthropology,"&lt;img alt=&quot;Covered in OneSearch&quot; src=&quot;https://libapps.s3.amazonaws.com/accounts/7085/images/SmallOneSearchO.png&quot; title=&quot;Covered in OneSearch&quot; /&gt;  Border and Migration Studies Online provides historical context and resources, representing both personal and institutional perspectives, for the growing fields of border(land) studies and migration studies, as well as history, law, politics, diplomacy, area and global studies, anthropology, medicine, the arts, and more. At completion, the collection will include 100,000 pages of text, 175 hours of video, and 1,000 images.", DESCRIPTION A PLACEHOLDER, DESCRIPTION B PLACEHOLDER,https://search.alexanderstreet.com/bord,
62130209,Disability in the Modern World,Public Health;American Studies;Asian American Studies;History;Database EBA,"&lt;p&gt;&lt;img src=&quot;https://libapps.s3.amazonaws.com/accounts/7085/images/SmallOneSearchO.png&quot; alt=&quot;Covered in OneSearch&quot; width=&quot;17&quot; height=&quot;15&quot;&gt;Disability in the Modern World: History of a Social Movement is a landmark online collection that fills the gap, with a comprehensive and international set of resources to enrich study in a wide range of disciplines from media studies to philosophy. This database includes 150,000 pages of primary sources, supporting materials, and archives, along with 125 hours of video. The content is essential for the growing disciplines of disability history and disability studies, but also in history, media, the arts, political science, education, and other areas where the contributions of the disability community have been typically overlooked.&lt;/p&gt;&lt;p&gt;&lt;strong&gt;Available through June 30, 2025&lt;/strong&gt;&lt;/p&gt;", DESCRIPTION A PLACEHOLDER, DESCRIPTION B PLACEHOLDER,https://search.alexanderstreet.com/disa,
62130210,LGBT Thought and Culture,English and Comparative Literature;American Studies;Asian American Studies;Chicana & Chicano Studies;History;Gender and Sexuality Studies;Anthropology;Queer Studies,"&lt;img alt=&quot;Covered in OneSearch&quot; src=&quot;https://libapps.s3.amazonaws.com/accounts/7085/images/SmallOneSearchO.png&quot; title=&quot;Covered in OneSearch&quot; /&gt; LGBT Thought and Culture is an online resource hosting the key works and archival documentation of LGBT political and social movements throughout the 20th century and into the present day. The collection contains 150,000 pages of rare archival content, including seminal texts, letters, periodicals, speeches, interviews, and ephemera.", DESCRIPTION A PLACEHOLDER, DESCRIPTION B PLACEHOLDER,https://search.alexanderstreet.com/gltc,
62130211,North American Indian Drama: Second Edition,English and Comparative Literature;American Studies;History;Theatre;Cultural Anthropology,"&lt;img alt=&quot;Covered in OneSearch&quot; src=&quot;https://libapps.s3.amazonaws.com/accounts/7085/images/SmallOneSearchO.png&quot; title=&quot;Covered in OneSearch&quot; /&gt; North American Indian Drama, Second Edition brings together 250+ full-text plays representing the stories and creative energies of American Indian and First Nation playwrights of the twentieth century. Many of the plays are previously unpublished or hard to find, and they represent a wealth of dramatic material that is often overlooked or inaccessible.", DESCRIPTION A PLACEHOLDER, DESCRIPTION B PLACEHOLDER,https://ind2.alexanderstreet.com,
62130212,Early English Books Online,English and Comparative Literature;History,"&lt;p&gt;&lt;img src=&quot;https://libapps.s3.amazonaws.com/accounts/7085/images/SmallOneSearchO.png&quot; alt=&quot;Covered in OneSearch&quot; width=&quot;17&quot; height=&quot;15&quot;&gt;Early English Books Online (EEBO) is the definitive online collection of early printed works in English, and works printed in England, making digital copies of over 146,000 titles from before 1700 discoverable through an interface tailored for early modern scholars. No other resource for early modern scholarship is as comprehensive as Early English Books Online. Users can explore complete, digitized images of all the works listed in these key bibliographic records of English literature: The Short-Title Catalogue (Pollard &amp;amp; Redgrave, 1475-1640); The Short-Title Catalogue II (Wing, 1641-1700); The Thomason Tracts; and the Early English Books Tract Supplements, as well as original almanacs, pamphlets, musical scores, prayer books and other intriguing primary sources.&lt;/p&gt;", DESCRIPTION A PLACEHOLDER, DESCRIPTION B PLACEHOLDER,https://www.proquest.com/emb?accountid=9840,
62130213,LGBT Magazine Archive Collections 1-2,English and Comparative Literature;American Studies;Asian American Studies;History;Gender and Sexuality Studies;Queer Studies;Cultural Anthropology;Database EBA,"&lt;p&gt;&lt;img src=&quot;https://libapps.s3.amazonaws.com/accounts/7085/images/SmallOneSearchO.png&quot; alt=&quot;Covered in OneSearch&quot; width=&quot;17&quot; height=&quot;15&quot;&gt;The archives of 26 leading but previously hard-to-find magazines are included in LGBT Magazine Archive, including many of the longest-running, most influential publications of this type. The complete backfile of The Advocate is made available digitally for the first time. As one of the very few LGBT titles to pre-date the 1969 Stonewall riots, it spans the history of the gay rights movement. LGBT Magazine Archive also includes the principal UK titles, notably Gay News and its successor publication Gay Times.&lt;/p&gt;", DESCRIPTION A PLACEHOLDER, DESCRIPTION B PLACEHOLDER,https://www.proquest.com/lgbtma?accountid=9840,
62130215,Indian Claims Insight,English and Comparative Literature;American Studies;History;Anthropology;Archaeological Anthropology;Cultural Anthropology;Database EBA;Native American Studies,"&lt;img alt=&quot;Covered in OneSearch&quot; src=&quot;https://libapps.s3.amazonaws.com/accounts/7085/images/SmallOneSearchO.png&quot; title=&quot;Covered in OneSearch&quot; /&gt; Indian Claims Insight provides researchers with the opportunity to understand and analyze Native American migration and resettlement throughout U.S. history in the context of U.S. Government Indian removal policies and subsequent actions to address Native American claims. &lt;p&gt;&lt;b&gt;Available through June 30, 2025&lt;/b&gt;&lt;/p&gt;", DESCRIPTION A PLACEHOLDER, DESCRIPTION B PLACEHOLDER,https://indianclaims.proquest.com/indianclaims?accountid=9840,
62130216,Black Abolitionist Papers: 1830-1865,African American Studies;American Studies;History,"&lt;img alt=&quot;Covered in OneSearch&quot; src=&quot;https://libapps.s3.amazonaws.com/accounts/7085/images/SmallOneSearchO.png&quot; title=&quot;Covered in OneSearch&quot; /&gt; This primary source collection details the extensive work of African Americans to abolish slavery in the United States prior to the Civil War. Covering the period 1830-1865, the collection presents the international impact of African American activism against slavery, in the writings of the activists themselves. The approximately 15,000 articles, documents, correspondence, proceedings, manuscripts, and literary works of almost 300 Black abolitionists show the full range of their activities in the United States, Canada, England, Scotland, Ireland, France and Germany.", DESCRIPTION A PLACEHOLDER, DESCRIPTION B PLACEHOLDER,https://www.proquest.com/bap?accountid=9840,
62130217,African American Police League Records: 1961-1988,African American Studies;American Studies;History,"&lt;img alt=&quot;Covered in OneSearch&quot; src=&quot;https://libapps.s3.amazonaws.com/accounts/7085/images/SmallOneSearchO.png&quot; title=&quot;Covered in OneSearch&quot; /&gt;  This history vault module documents how African American policemen in Chicago, beginning in 1968, attempted to fight against discrimination and police brutality by the Chicago Police Department and to improve relations between African Americans and police. Researchers will find a wealth of resources from the African American Police League, including annual reports, court files, meeting minutes, correspondence, clippings, topical files, newsletters, police brutality files, and publications and flyers covering the work of the AAPL and its education and action arm, the League to Improve the Community. The collection also contains items on numerous law enforcement and civil rights organizations across the country; materials on the suspension of AAPL executive director Renault Robinson from the Chicago Police Department and related lawsuits; and materials pertaining to the National Black Police Association.", DESCRIPTION A PLACEHOLDER, DESCRIPTION B PLACEHOLDER,https://hv.proquest.com/historyvault/hv.jsp?pageid=advanced_ui&module=12421,
62130219,"American Indians and the American West, 1809-1971",American Studies;History;Anthropology;Archaeological Anthropology;Cultural Anthropology;Native American Studies,"&lt;img alt=&quot;Covered in OneSearch&quot; src=&quot;https://libapps.s3.amazonaws.com/accounts/7085/images/SmallOneSearchO.png&quot; title=&quot;Covered in OneSearch&quot; /&gt;  Collections from the U.S. National Archives and the Chicago History Museum join first-hand accounts on Indian Wars and westward migration. Coverage includes Records of the Bureau of Indian Affairs and Records from the Major Council Meetings of American Indian Tribes. Researchers will also find excellent collections, many previously unpublished, on Native Americans in the 19th century, with a focus on the interaction among white settlers, the U.S. federal government and indigenous tribes.", DESCRIPTION A PLACEHOLDER, DESCRIPTION B PLACEHOLDER,https://www.proquest.com/hvamericanindians,
62130220,American Politics and Society,African American Studies;English and Comparative Literature;American Studies;Asian American Studies;Chicana & Chicano Studies;History;Latin American Studies;Gender and Sexuality Studies;Political Science;Database EBA,"&lt;img alt=&quot;Covered in OneSearch&quot; src=&quot;https://libapps.s3.amazonaws.com/accounts/7085/images/SmallOneSearchO.png&quot; title=&quot;Covered in OneSearch&quot; /&gt; American Politics and Society is a wide-ranging category, focused on American Politics in the 19th and 20th centuries. The collections in this category range span records of Temperance organizations, 1830-1933; immigration records during the massive immigration wave from 1880-1930; legal collections from the Harvard Law School Library, including papers of three Supreme Court Justices; numerous collections on Progressive Era politics; and records from the Franklin D. Roosevelt White House through Gerald R. Ford presidencies. &lt;p&gt;&lt;b&gt;Available through June 30, 2025&lt;/b&gt;&lt;/p&gt;", DESCRIPTION A PLACEHOLDER, DESCRIPTION B PLACEHOLDER,https://www.proquest.com/hvpoliticsandsociety,
62130222,Civil Rights and the Black Freedom Struggle,African American Studies;American Studies;History;Database EBA,"&lt;img alt=&quot;Covered in OneSearch&quot; src=&quot;https://libapps.s3.amazonaws.com/accounts/7085/images/SmallOneSearchO.png&quot; title=&quot;Covered in OneSearch&quot; /&gt;  Features records of NAACP, SCLC, SNCC, CORE, National Association of Colored Women’s Clubs, Mary McLeod Bethune, African American Police League, National Baptist Convention and federal records on the Black Freedom Struggle[[BR]][[BR]][[BR]][[BR]][[BR]][[BR]]This category offers the opportunity to study the most well-known and also unheralded events of the Black Freedom Struggle in the 20th Century from the perspective of the men, women, and sometimes even children who waged one of the most inspiring social movements in American history. This category includes NAACP Papers, federal government records, organizational records, and personal papers regarding the 20th Century Black Freedom Struggle. NAACP Papers consists of 6 modules. Black Freedom Struggle in the 20th Century consists of four modules. &lt;p&gt;&lt;b&gt;Available through June 30, 2025&lt;/b&gt;&lt;/p&gt;", DESCRIPTION A PLACEHOLDER, DESCRIPTION B PLACEHOLDER,https://www.proquest.com/hvcivilrights,
62130224,"Black Freedom Struggle in the 20th Century: Organizational Records and Personal Papers, Part 1",African American Studies;American Studies;History,"&lt;img alt=&quot;Covered in OneSearch&quot; src=&quot;https://libapps.s3.amazonaws.com/accounts/7085/images/SmallOneSearchO.png&quot; title=&quot;Covered in OneSearch&quot; /&gt; The Organizational Records and Personal Papers bring a new perspective to the Black Freedom Struggle via the records of major civil rights organizations and personal papers of leaders and observers of the 20th century Black freedom struggle. The three major civil rights organizations are the Southern Christian Leadership Conference, Brotherhood of Sleeping Car Porters, and the National Association of Colored Women's Clubs.", DESCRIPTION A PLACEHOLDER, DESCRIPTION B PLACEHOLDER,https://hv.proquest.com/historyvault/hv.jsp?pageid=advanced_ui&module=23138,
62130227,International Relations and Military Conflicts,African American Studies;American Studies;Asian American Studies;History;Latin American Studies;Asian Studies;Political Science;Database EBA,"&lt;img alt=&quot;Covered in OneSearch&quot; src=&quot;https://libapps.s3.amazonaws.com/accounts/7085/images/SmallOneSearchO.png&quot; title=&quot;Covered in OneSearch&quot; /&gt;  Features formerly confidential reports of U.S. diplomats and military officers, 1911-1975, as well as records from the British Foreign Office, covering international relations and conditions in the countries where officials were stationed.[[BR]][[BR]][[BR]][[BR]][[BR]][[BR]]Collections in this category span 1911-1975, offering a detailed view of U.S. foreign relations. These collections provide an excellent view of U.S. international relations during these important years, and also offer detailed information on the countries in which the U.S. diplomatic or military officials were stationed, making these collections an excellent source for studies of individual countries or regions of the world. Two modules in this category also cover the British Foreign Office. &lt;p&gt;&lt;b&gt;Available through June 30, 2025&lt;/b&gt;&lt;/p&gt;", DESCRIPTION A PLACEHOLDER, DESCRIPTION B PLACEHOLDER,https://www.proquest.com/hvinternationalrelations,
62130230,"Japanese American Incarceration: Records of the War Relocation Authority, 1942-1946",English and Comparative Literature;American Studies;Asian American Studies;History,"&lt;p&gt;&lt;img src=&quot;https://libapps.s3.amazonaws.com/accounts/7085/images/SmallOneSearchO.png&quot; alt=&quot;Covered in OneSearch&quot; title=&quot;Covered in OneSearch&quot;&gt; Following the Japanese attack on Pearl Harbor and the U.S. entry into World War II in December 1941, the Roosevelt administration decided that for reasons of military necessity, the government would evacuate all persons of Japanese heritage from the West Coast states. The Records of the War Relocation Authority document the day-to-day running of the 10 relocation camps from 1942-1946. The collection is organized by relocation center. Records include reports and correspondence on issues such as security, education, health, vocational training, agriculture, food, and family welfare.&lt;/p&gt;", DESCRIPTION A PLACEHOLDER, DESCRIPTION B PLACEHOLDER,https://www.proquest.com/hvjapaneseincarceration/archival-materials/records-war-relocation-authority-1942-1946-field/docview/3058629176/sem-2?accountid=9840,
62130232,Law and Society since the Civil War: American Legal Manuscripts from the Harvard Law School Library,American Studies;Asian American Studies;Criminal Justice;History;Political Science;Database EBA,"&lt;p&gt;&lt;img src=&quot;https://libapps.s3.amazonaws.com/accounts/7085/images/SmallOneSearchO.png&quot; alt=&quot;Covered in OneSearch&quot; title=&quot;Covered in OneSearch&quot;&gt; This module consists of 11 collections from the Harvard Law School Library, highlighting three Supreme Court Justices, the first Black federal judge, high-profile cases, and insights into developing ideologies and laws, as far back as 1861 with the Papers of Oliver Wendell Holmes, which span from the Civil War to the Great Depression. The Papers of Louis D. Brandeis and Felix Frankfurter provide a behind-the-scenes view of the Supreme Court between 1919 and 1961. The Frankfurter Papers are of special note because they reveal how the Supreme Court approached the Brown v. Board of Education decision, the landmark school desegregation case that is well documented in other History Vault modules.&lt;/p&gt;&lt;p&gt;&lt;strong&gt;Available through June 30, 2025&lt;/strong&gt;&lt;/p&gt;", DESCRIPTION A PLACEHOLDER, DESCRIPTION B PLACEHOLDER,https://www.proquest.com/hvlawandsocietyharv,
62130233,Margaret Sanger Papers: Smith College Collections and Collected Documents,English and Comparative Literature;American Studies;History;Gender and Sexuality Studies,"&lt;p&gt;&lt;img src=&quot;https://libapps.s3.amazonaws.com/accounts/7085/images/SmallOneSearchO.png&quot; alt=&quot;Covered in OneSearch&quot; title=&quot;Covered in OneSearch&quot;&gt; &quot;I seem to have no life and no history apart from the birth control movement,&quot; Margaret Sanger wrote in 1938. And, indeed, there was almost no phase of the birth control movement in which Margaret Sanger did not play a significant role. Her collection of papers reveals a complex portrait of the personal and public lives of one of the 20th centurys most influential and controversial figures. The collection is a premier resource for examining changing attitudes towards womens roles and sexuality over time. Coverage spans the birth control movement, including the movements changing ideologies, its campaign for legitimacy, and its internal conflicts and organizational growth.&lt;/p&gt;", DESCRIPTION A PLACEHOLDER, DESCRIPTION B PLACEHOLDER,https://www.proquest.com/hvmsangerpapers?accountid=9840,
62130240,New Deal and World War II: President Franklin D. Roosevelt's Office Files and Records of Federal Agencies,American Studies;Asian American Studies;History;Latin American Studies;Database EBA,"&lt;p&gt;&lt;img src=&quot;https://libapps.s3.amazonaws.com/accounts/7085/images/SmallOneSearchO.png&quot; alt=&quot;Covered in OneSearch&quot; title=&quot;Covered in OneSearch&quot;&gt; The centerpiece of this module is President Franklin D. Roosevelts Office Files. Roosevelts Office Files constitute the heart and soul of the administrative record of the Roosevelt White House. They highlight the domestic and foreign concerns of the President and his administration. Roosevelt's policies, responses to crises, and plans for the future were all based on both classified and nonclassified information that he received and digested from all levels of government and the public. The office files represent the materials deemed especially important by the President on the basis of content and source. Major topics covered in the files are the Great Depression, the New Deal, America's involvement in World War II, the internal workings of the Roosevelt administration, and Roosevelt's personal leadership style.&lt;/p&gt;&lt;p&gt;&lt;strong&gt;Available through June 30, 2025&lt;/strong&gt;&lt;/p&gt;", DESCRIPTION A PLACEHOLDER, DESCRIPTION B PLACEHOLDER,https://www.proquest.com/hvnewdealfdr?accountid=9840,
62130246,"Revolutionary War and Early America: Collections from the Massachusetts Historical Society, 1721-1860",American Studies;History;Database EBA,"The success of the musical Hamilton has led to increased interest in this pivotal period in American history. This module on one of the most-studied periods in American history consists of 26 collections from the holdings of the Massachusetts Historical Society, the first North American historical society and the first library to devote its primary attention to collecting Americana. The collections digitized by ProQuest from the holdings of the Massachusetts Historical Society focus on the Colonial Era, the Revolutionary War and the Early National Period, with some collections extending into the Civil War era. &lt;p&gt;&lt;b&gt;Available through June 30, 2025&lt;/b&gt;&lt;/p&gt;", DESCRIPTION A PLACEHOLDER, DESCRIPTION B PLACEHOLDER,https://www.proquest.com/hvrevolutionarywarmhs,
