Database_ID,Database_Name,Associated_Subjects,Original_Description_HTML,Rewritten_Description_A_HTML,Rewritten_Description_B_HTML,Database_URL,
68751785,Empire Online,Database EBA,"&lt;p&gt;&lt;img src=&quot;https://libapps.s3.amazonaws.com/accounts/7085/images/SmallOneSearchO.png&quot; alt=&quot;Covered in OneSearch&quot; width=&quot;17&quot; height=&quot;15&quot;&gt;This resource brings together manuscript, printed and visual primary source materials for the study of 'Empire' and its theories, practices and consequences. The materials span across the last five centuries and are accompanied by a host of secondary learning resources including scholarly essays, maps and an interactive chronology.&lt;/p&gt;&lt;p&gt;&lt;strong&gt;Available through July 31, 2025&lt;/strong&gt;&lt;/p&gt;", DESCRIPTION A PLACEHOLDER, DESCRIPTION B PLACEHOLDER,https://www.empire.amdigital.co.uk/,
68751786,Ethnomusicology: Global Field Recordings,African American Studies;Asian American Studies;Chicana & Chicano Studies;Latin American Studies;Linguistics;Anthropology;Modern Languages & Literatures;Cultural Anthropology;Database EBA,"&lt;p&gt;&lt;img src=&quot;https://libapps.s3.amazonaws.com/accounts/7085/images/SmallOneSearchO.png&quot; alt=&quot;Covered in OneSearch&quot; width=&quot;17&quot; height=&quot;15&quot;&gt;Delve into the cultural study of music and explore content from across the globe with this diverse and comprehensive collection. Produced in collaboration with the UCLA Ethnomusicology Archive, the material in this collection includes thousands of audio field recordings and interviews, educational recordings, film footage, field notebooks, slides, correspondence and ephemera from over 60 fields of study.&lt;/p&gt;&lt;p&gt;&lt;strong&gt;Available through July 31, 2025&lt;/strong&gt;&lt;/p&gt;", DESCRIPTION A PLACEHOLDER, DESCRIPTION B PLACEHOLDER,https://www.ethnomusicology.amdigital.co.uk/,
68751787,Everyday Life & Women in America 1800-1920,Database EBA,"&lt;p&gt;&lt;img src=&quot;https://libapps.s3.amazonaws.com/accounts/7085/images/SmallOneSearchO.png&quot; alt=&quot;Covered in OneSearch&quot; width=&quot;17&quot; height=&quot;15&quot;&gt;Everyday Life &amp;amp; Women in America comprises thousands of fully searchable images of monographs, pamphlets, periodicals and broadsides addressing 19th and early 20th century political, social and gender issues, religion, race, education, employment, marriage, sexuality, home and family life, health, and pastimes. The collection is especially rich in conduct of life and domestic management literature, offering vivid insights into the daily lives of women and men, as well as emphasizing contrasts in regional, urban and rural cultures.&lt;/p&gt;&lt;p&gt;&lt;strong&gt;Available through July 31, 2025&lt;/strong&gt;&lt;/p&gt;", DESCRIPTION A PLACEHOLDER, DESCRIPTION B PLACEHOLDER,https://www.everydaylife.amdigital.co.uk/,
68751788,First World War,Database EBA,"&lt;p&gt;&lt;img src=&quot;https://libapps.s3.amazonaws.com/accounts/7085/images/SmallOneSearchO.png&quot; alt=&quot;Covered in OneSearch&quot; width=&quot;17&quot; height=&quot;15&quot;&gt;The First World War portal makes available invaluable primary sources for the study of the Great War, brought together in four thematic modules. From personal collections and rare printed material to military files, artwork and audio-visual files, content highlights the experiences of soldiers, civilians and governments on both sides of a conflict that shook the world.&lt;/p&gt;&lt;p&gt;&lt;strong&gt;Available through July 31, 2025&lt;/strong&gt;&lt;/p&gt;", DESCRIPTION A PLACEHOLDER, DESCRIPTION B PLACEHOLDER,https://www.firstworldwar.amdigital.co.uk/,
68751789,Food and Drink in History,African American Studies;Chicana & Chicano Studies;Latin American Studies;Anthropology;Cultural Anthropology;Database EBA,"&lt;p&gt;&lt;img src=&quot;https://libapps.s3.amazonaws.com/accounts/7085/images/SmallOneSearchO.png&quot; alt=&quot;Covered in OneSearch&quot; width=&quot;17&quot; height=&quot;15&quot;&gt;Explore a wide range of primary source material, including printed and manuscript cookbooks, advertising ephemera, government reports, films, and illustrated content revealing the evolution of food and drink within everyday life and the public sphere. The unique material in this collection has been sourced from across the globe to reflect a wide range of food cultures and traditions, creating an unparalleled resource for research.&lt;/p&gt;&lt;p&gt;&lt;strong&gt;Available through July 31, 2025&lt;/strong&gt;&lt;/p&gt;", DESCRIPTION A PLACEHOLDER, DESCRIPTION B PLACEHOLDER,https://www.foodanddrink.amdigital.co.uk/,
68751790,Foreign Office Files for China 1919-1980,Database EBA,"&lt;p&gt;&lt;img src=&quot;https://libapps.s3.amazonaws.com/accounts/7085/images/SmallOneSearchO.png&quot; alt=&quot;Covered in OneSearch&quot; width=&quot;17&quot; height=&quot;15&quot;&gt;Due to the long-unique nature of the relationship between Britain and China, these formerly restricted British government documents, consisting of diplomatic dispatches, letters, newspaper cuttings, maps, reports of court cases, biographies of leading personalities, summaries of events and diverse other materials, provide unprecedented levels of detail into one of the most turbulent centuries of Chinese history.&lt;/p&gt;&lt;p&gt;&lt;strong&gt;Available through July 31, 2025&lt;/strong&gt;&lt;/p&gt;", DESCRIPTION A PLACEHOLDER, DESCRIPTION B PLACEHOLDER,https://www.archivesdirect.amdigital.co.uk/FO_China,
68774235,Children's Literature and Culture,Database EBA,"&lt;p&gt;&lt;img src=&quot;https://libapps.s3.amazonaws.com/accounts/7085/images/SmallOneSearchO.png&quot; alt=&quot;Covered in OneSearch&quot; width=&quot;17&quot; height=&quot;15&quot;&gt;Virtually nothing of cultural significance escapes being touched upon in some way within childrens print culture, so examining the literature produced for its young people is a way of probing the evolving nature of a society. Across time and place, text and image alike convey the expectations that societies have of their children and present, in simply worded and visually compelling ways, the aspects and challenges of everyday life faced by young people and their families. Childrens Literature and Culture is a unique, robust, and visually stunning primary source collection that documents this literature and print culture. Bridging the didactic chapbook era of the long eighteenth century with the plot- and image-driven books of the early twentieth century, and covering many other document types in between, the material in this resource will be essential to students and researchers interested in a broad spread of topics.&lt;/p&gt;&lt;p&gt;&lt;strong&gt;Available through July 31, 2025&lt;/strong&gt;&lt;/p&gt;", DESCRIPTION A PLACEHOLDER, DESCRIPTION B PLACEHOLDER,https://www.childrensliterature.amdigital.co.uk/,
68774239,"Foreign Office Files for the Middle East, 1971-1981",Database EBA,"&lt;p&gt;&lt;img src=&quot;https://libapps.s3.amazonaws.com/accounts/7085/images/SmallOneSearchO.png&quot; alt=&quot;Covered in OneSearch&quot; width=&quot;17&quot; height=&quot;15&quot;&gt;This collection is an essential resource for understanding the events in the Middle East during the 1970s. It addresses the policies, economies, political relationships and significant events of every major Middle East power. Conflicts such as the Arab-Israeli War, the Lebanese Civil War and the Iranian Revolution are examined in detail, as are the military interventions and peace negotiations carried out by regional and foreign powers like the United States and Russia.&lt;/p&gt;&lt;p&gt;&lt;strong&gt;Available through July 31, 2025&lt;/strong&gt;&lt;/p&gt;", DESCRIPTION A PLACEHOLDER, DESCRIPTION B PLACEHOLDER,https://www.archivesdirect.amdigital.co.uk/FO_MiddleEast,
68774242,Gender: Identity and Social Change,Database EBA,"&lt;p&gt;&lt;img src=&quot;https://libapps.s3.amazonaws.com/accounts/7085/images/SmallOneSearchO.png&quot; alt=&quot;Covered in OneSearch&quot; width=&quot;17&quot; height=&quot;15&quot;&gt;Essential primary sources documenting the changing representations and lived experiences of gender roles and relations from the nineteenth century to the present. This expansive collection offers sources for the study of women's suffrage, the feminist movement, the mens movement, employment, education, the body, the family, and government and politics.&lt;/p&gt;", DESCRIPTION A PLACEHOLDER, DESCRIPTION B PLACEHOLDER,https://www.genderidentityandsocialchange.amdigital.co.uk/,
68774243,Global Commodities,Database EBA,"&lt;p&gt;&lt;img src=&quot;https://libapps.s3.amazonaws.com/accounts/7085/images/SmallOneSearchO.png&quot; alt=&quot;Covered in OneSearch&quot; width=&quot;17&quot; height=&quot;15&quot;&gt;This resource brings together manuscript, printed and visual primary source materials for the study of global commodities in world history. The commodities featured in this resource have been transported, exchanged and consumed around the world for hundreds of years. They helped transform societies, global trading operations, habits of consumption and social practices.&lt;/p&gt;&lt;p&gt;&lt;strong&gt;Available through July 31, 2025&lt;/strong&gt;&lt;/p&gt;", DESCRIPTION A PLACEHOLDER, DESCRIPTION B PLACEHOLDER,https://www.globalcommodities.amdigital.co.uk/,
68774247,"Jewish Life in America, c1654-1954",Database EBA,"&lt;p&gt;&lt;img src=&quot;https://libapps.s3.amazonaws.com/accounts/7085/images/SmallOneSearchO.png&quot; alt=&quot;Covered in OneSearch&quot; width=&quot;17&quot; height=&quot;15&quot;&gt;Jewish Life in America provides access to a diverse range of records which can be used to explore the history of Jewish communities in the United States of America, from the arrival of the first Jews in New Amsterdam in the 17th century right through to the mid-20th century. Sourced from archival collections held by the American Jewish Historical Society in New York City, this rich collection brings communal and social aspects of Jewish identity and culture to life while tracing Jewish involvement in the life of American society as a whole.&lt;/p&gt;", DESCRIPTION A PLACEHOLDER, DESCRIPTION B PLACEHOLDER,https://www.jewishlife.amdigital.co.uk/,
68774471,"Foreign Office Files for India, Pakistan and Afghanistan, 1947-1980",Database EBA,"&lt;p&gt;&lt;img src=&quot;https://libapps.s3.amazonaws.com/accounts/7085/images/SmallOneSearchO.png&quot; alt=&quot;Covered in OneSearch&quot; width=&quot;17&quot; height=&quot;15&quot;&gt;Foreign Office Files for India, Pakistan and Afghanistan, 1947-1980consists of the complete run of documents in the series DO 133, DO 134 and FCO 37, as well as all documents covering the Indian subcontinent in the FO 371 series. Events covered include independence and partition, the Indian annexation of Hyderabad and Goa, war between India and Pakistan, tensions and war between India and China, the consolidation of power of the Congress Party in India, military rule in Pakistan, the turbulent independence of Bangladesh and the development of nuclear weapons in the region.&lt;/p&gt;&lt;p&gt;&lt;strong&gt;Available through July 31, 2025&lt;/strong&gt;&lt;/p&gt;", DESCRIPTION A PLACEHOLDER, DESCRIPTION B PLACEHOLDER,https://www.archivesdirect.amdigital.co.uk/FO_India,
68774472,"Foreign Office Files for Japan, 1919-1952",Database EBA,"&lt;p&gt;&lt;img src=&quot;https://libapps.s3.amazonaws.com/accounts/7085/images/SmallOneSearchO.png&quot; alt=&quot;Covered in OneSearch&quot; width=&quot;17&quot; height=&quot;15&quot;&gt;These Foreign Office files cover British concerns over colonial-held territory in the Far East, as well as Japanese relations with China, Russia, Germany and the United States. Following surrender at the end of the Second World War, Japan was occupied by foreign forces for the first time in its history. The occupation resulted in disarmament, liberalisation and a new constitution as the country was transformed into a parliamentary democracy. Japan emerged once again as a player on the world stage.&lt;/p&gt;&lt;p&gt;&lt;strong&gt;Available through July 31, 2025&lt;/strong&gt;&lt;/p&gt;", DESCRIPTION A PLACEHOLDER, DESCRIPTION B PLACEHOLDER,https://www.archivesdirect.amdigital.co.uk/FO_Japan,
68774473,"Foreign Office Files for South East Asia, 1963-1980",Database EBA,"&lt;p&gt;&lt;img src=&quot;https://libapps.s3.amazonaws.com/accounts/7085/images/SmallOneSearchO.png&quot; alt=&quot;Covered in OneSearch&quot; width=&quot;17&quot; height=&quot;15&quot;&gt;This collection follows the establishment of an independent Malaysia in 1963, following the release of the Cobbold Commission Report. Under President Sukarno, Indonesia strongly opposed this decision and hostilities between the two countries escalated. Alongside tensions with Malaysia, Indonesia would experience growing civil unrest in this period, with anti-Communist sentiments on the rise. Documents featured in this collection cover these fundamental events alongside a number of key themes, including trade, economic development and authoritarian rule in this period.&lt;/p&gt;&lt;p&gt;&lt;strong&gt;Available through July 31, 2025&lt;/strong&gt;&lt;/p&gt;", DESCRIPTION A PLACEHOLDER, DESCRIPTION B PLACEHOLDER,https://www.archivesdirect.amdigital.co.uk/FO_SEAsia,
68774476,"Frontier Life: Borderlands, Settlement & Colonial Encounters",African American Studies;American Studies;Chicana & Chicano Studies;History;Latin American Studies;Anthropology;Cultural Anthropology;Database EBA;Native American Studies,"&lt;p&gt;&lt;img src=&quot;https://libapps.s3.amazonaws.com/accounts/7085/images/SmallOneSearchO.png&quot; alt=&quot;Covered in OneSearch&quot; width=&quot;17&quot; height=&quot;15&quot;&gt;This digital collection of primary source documents helps us to understand existence on the edges of the anglophone world from 1650-1920. Discover the various European and colonial frontier regions of North America, Africa and Australasia through documents that reveal the lives of settlers and indigenous peoples in these areas.&lt;/p&gt;&lt;p&gt;&lt;strong&gt;Available through July 31, 2025&lt;/strong&gt;&lt;/p&gt;", DESCRIPTION A PLACEHOLDER, DESCRIPTION B PLACEHOLDER,https://www.frontierlife.amdigital.co.uk/,
68774477,Gilded Age and Progressive Era,Database EBA,"&lt;p&gt;&lt;img src=&quot;https://libapps.s3.amazonaws.com/accounts/7085/images/SmallOneSearchO.png&quot; alt=&quot;Covered in OneSearch&quot; width=&quot;17&quot; height=&quot;15&quot;&gt;The period after the Civil War in America became known as the Gilded Age, coined by Mark Twain in his seminal novelThe Gilded Age: A Tale of Today, playing on the failure of the expected 'golden era' of Reconstruction. This resource aims to showcase the transformation of America into a modern, urban, industrial global power through business, legal and personal papers. Technological progress and extreme wealth for the few, contrasted with stark inequality and endemic poverty for much of America's population.&lt;/p&gt;&lt;p&gt;&lt;strong&gt;Available through July 31, 2025&lt;/strong&gt;&lt;/p&gt;", DESCRIPTION A PLACEHOLDER, DESCRIPTION B PLACEHOLDER,https://www.gildedage.amdigital.co.uk/,
68774480,"India, Raj and Empire",Database EBA,"&lt;p&gt;&lt;img src=&quot;https://libapps.s3.amazonaws.com/accounts/7085/images/SmallOneSearchO.png&quot; alt=&quot;Covered in OneSearch&quot; width=&quot;17&quot; height=&quot;15&quot;&gt;Explore the history of South Asia between the foundation of the East India Company in 1615 and the granting of independence to India and Pakistan in 1947, through the wonderfully rich and diverse manuscript collections of the National Library of Scotland.&lt;/p&gt;&lt;p&gt;&lt;strong&gt;Available through July 31, 2025&lt;/strong&gt;&lt;/p&gt;", DESCRIPTION A PLACEHOLDER, DESCRIPTION B PLACEHOLDER,https://www.indiaraj.amdigital.co.uk/,
68774481,J. Walter Thompson: Advertising America,Database EBA,"&lt;p&gt;&lt;img src=&quot;https://libapps.s3.amazonaws.com/accounts/7085/images/SmallOneSearchO.png&quot; alt=&quot;Covered in OneSearch&quot; width=&quot;17&quot; height=&quot;15&quot;&gt;The J. Walter Thompson Company Archive documents the history, operation, policies and accomplishments of one of the world's largest and oldest advertising firms. The papers here reveal many aspects of twentieth-century cultural, social, business, marketing, consumer and economic history while investigating the human psyche.&lt;/p&gt;&lt;p&gt;&lt;strong&gt;Available through July 31, 2025&lt;/strong&gt;&lt;/p&gt;", DESCRIPTION A PLACEHOLDER, DESCRIPTION B PLACEHOLDER,https://www.jwtadvertisingamerica.amdigital.co.uk/,
68774483,"Leisure, Travel & Mass Culture: The History of Tourism",Database EBA,"&lt;p&gt;&lt;img src=&quot;https://libapps.s3.amazonaws.com/accounts/7085/images/SmallOneSearchO.png&quot; alt=&quot;Covered in OneSearch&quot; width=&quot;17&quot; height=&quot;15&quot;&gt;This resource presents a multi-national journey through well-known, little-known and far-flung destinations unlocked for the average traveller between 1850 and the 1980s. Guidebooks and brochures, periodicals, travel agency correspondence, photographs and personal travel journals provide unique insight into the expansion, accessibility and affordability of tourism for the masses and the evolution of some of the most successful travel agencies in the world.&lt;/p&gt;&lt;p&gt;&lt;strong&gt;Available through July 31, 2025&lt;/strong&gt;&lt;/p&gt;", DESCRIPTION A PLACEHOLDER, DESCRIPTION B PLACEHOLDER,https://www.masstourism.amdigital.co.uk/,
68774484,Literary Manuscripts Berg,Database EBA,"&lt;p&gt;&lt;img src=&quot;https://libapps.s3.amazonaws.com/accounts/7085/images/SmallOneSearchO.png&quot; alt=&quot;Covered in OneSearch&quot; width=&quot;17&quot; height=&quot;15&quot;&gt;Literary Manuscripts is drawn from the nineteenth century holdings of the Henry W. and Albert A. Berg Collection of English and American Literature at the New York Public Library. While the holdings of the Berg extend from 1480 to the present day, its most extensive holdings date from the nineteenth century. The following fifteen author collections were selected with guidance from Dr Isaac Gewirtz, curator of the collection. They were selected with reference to the importance of each authors' contribution to Victorian literature, and the strength and significance of the Berg's holdings for that author.&lt;/p&gt;&lt;p&gt;&lt;strong&gt;Available through July 31, 2025&lt;/strong&gt;&lt;/p&gt;", DESCRIPTION A PLACEHOLDER, DESCRIPTION B PLACEHOLDER,https://www.literarymanuscriptsberg.amdigital.co.uk/,
68774485,Literary Manuscripts Leeds,Database EBA,"&lt;p&gt;&lt;img src=&quot;https://libapps.s3.amazonaws.com/accounts/7085/images/SmallOneSearchO.png&quot; alt=&quot;Covered in OneSearch&quot; width=&quot;17&quot; height=&quot;15&quot;&gt;Examine complete images of 190 manuscripts of seventeenth and eighteenth-century verse held in the celebrated Brotherton Collection at the University of Leeds. These manuscripts can be read and explored in conjunction with the Brotherton Collection Manuscript Verse Index, which includes first lines, last lines, attribution, author, title, date, length, verse form, content and bibliographic references for over 6,600 poems within the collection.&lt;/p&gt;&lt;p&gt;&lt;strong&gt;Available through July 31, 2025&lt;/strong&gt;&lt;/p&gt;", DESCRIPTION A PLACEHOLDER, DESCRIPTION B PLACEHOLDER,https://www.literarymanuscriptsleeds.amdigital.co.uk/,
68774486,Literary Print Culture,Database EBA,"&lt;p&gt;&lt;img src=&quot;https://libapps.s3.amazonaws.com/accounts/7085/images/SmallOneSearchO.png&quot; alt=&quot;Covered in OneSearch&quot; width=&quot;17&quot; height=&quot;15&quot;&gt;The Stationers Company Archive is one of the most important resources for understanding the workings of the early book trade, the printing and publishing community, the establishment of legal requirements for copyright provisions and the history of bookbinding. Explore extremely rare documents dating from 1554 to the 21st century in this invaluable resource of research material for historians and literary scholars.&lt;/p&gt;&lt;p&gt;&lt;strong&gt;Available through July 31, 2025&lt;/strong&gt;&lt;/p&gt;", DESCRIPTION A PLACEHOLDER, DESCRIPTION B PLACEHOLDER,https://www.literaryprintculture.amdigital.co.uk/,
68774487,London Low Life,Database EBA,"&lt;p&gt;&lt;img src=&quot;https://libapps.s3.amazonaws.com/accounts/7085/images/SmallOneSearchO.png&quot; alt=&quot;Covered in OneSearch&quot; width=&quot;17&quot; height=&quot;15&quot;&gt;This collection brings to life the teeming streets of Victorian London, inviting students and scholars to explore the gin palaces, brothels and East End slums of the nineteenth centurys greatest city. London Low Life is a full-text searchable resource, containing rare books, ephemera, maps and other materials relating to nineteenth and early twentieth-century London. It is designed for both teaching and study, from undergraduate to research students and beyond.&lt;/p&gt;&lt;p&gt;&lt;strong&gt;Available through July 31, 2025&lt;/strong&gt;&lt;/p&gt;", DESCRIPTION A PLACEHOLDER, DESCRIPTION B PLACEHOLDER,https://www.londonlowlife.amdigital.co.uk/,
68774488,"Macmillan Cabinet Papers, 1957-1963",Database EBA,"&lt;p&gt;&lt;img src=&quot;https://libapps.s3.amazonaws.com/accounts/7085/images/SmallOneSearchO.png&quot; alt=&quot;Covered in OneSearch&quot; width=&quot;17&quot; height=&quot;15&quot;&gt;Macmillan Cabinet Papers, 1957-1963provides complete coverage of the Cabinet conclusions (minutes) (CAB 128) and memoranda (CAB 129) of Harold Macmillans government, plus selected minutes and memoranda of policy committees (CAB 134).The Cabinet conclusions are taken by the secretary of the Cabinet or one of their assistants and consist of summaries of all discussions in Cabinet, together with a note of decisions reached. Cabinet memoranda consist of all papers circulated to members of the Cabinet and to other ministers for information or as a basis for discussion. These classes provide a distillation of the work of all the other departments of government, ranging in subject matter from agricultural policy and trade to nuclear policy and issues of international diplomacy.&lt;/p&gt;&lt;p&gt;&lt;strong&gt;Available through July 31, 2025&lt;/strong&gt;&lt;/p&gt;", DESCRIPTION A PLACEHOLDER, DESCRIPTION B PLACEHOLDER,https://www.archivesdirect.amdigital.co.uk/Macmillan,
68774489,Mass Observation Online,Database EBA,"&lt;p&gt;&lt;img src=&quot;https://libapps.s3.amazonaws.com/accounts/7085/images/SmallOneSearchO.png&quot; alt=&quot;Covered in OneSearch&quot; width=&quot;17&quot; height=&quot;15&quot;&gt;This resource offers revolutionary access to one of the most important archives for the study of Social History in the modern era. Explore original manuscript and typescript papers created and collected by the Mass Observation organisation, as well as printed publications, photographs and interactive features.&lt;/p&gt;&lt;p&gt;&lt;strong&gt;Available through July 31, 2025&lt;/strong&gt;&lt;/p&gt;", DESCRIPTION A PLACEHOLDER, DESCRIPTION B PLACEHOLDER,https://www.massobservation.amdigital.co.uk/,
68774490,Mass Observation Project,Database EBA,"&lt;p&gt;&lt;img src=&quot;https://libapps.s3.amazonaws.com/accounts/7085/images/SmallOneSearchO.png&quot; alt=&quot;Covered in OneSearch&quot; width=&quot;17&quot; height=&quot;15&quot;&gt;Mass Observation Project consists of all the directives (questionnaires) sent out by Mass Observation and the responses to them from the hundreds of Mass Observers. Addressing topics such as the Falklands War, clothing, attitudes to the USA, reading and television habits, morality and religion, and Britain's relations with Europe, the directives and responses are an essential resource for anyone interested in late-twentieth and early twenty-first-century British social history.&lt;/p&gt;&lt;p&gt;&lt;strong&gt;Available through July 31, 2025&lt;/strong&gt;&lt;/p&gt;", DESCRIPTION A PLACEHOLDER, DESCRIPTION B PLACEHOLDER,https://www.massobservationproject.amdigital.co.uk/,
68774491,Medical Services and Warfare,Database EBA,"&lt;p&gt;&lt;img src=&quot;https://libapps.s3.amazonaws.com/accounts/7085/images/SmallOneSearchO.png&quot; alt=&quot;Covered in OneSearch&quot; width=&quot;17&quot; height=&quot;15&quot;&gt;Explore multiple perspectives on the history of injury, treatment and disease on the front line. Chart scientific advances through hospital records, medical reports and first-hand accounts, and discover the evidence of how war shaped medical practice across the centuries.&lt;/p&gt;&lt;p&gt;&lt;strong&gt;Available through July 31, 2025&lt;/strong&gt;&lt;/p&gt;", DESCRIPTION A PLACEHOLDER, DESCRIPTION B PLACEHOLDER,https://www.medicalservicesandwarfare.amdigital.co.uk/,
